Loading feature extractor...
Feature extractor loaded successfully.

Starting training...
====================================================================================================
                                          TRAINING STARTED                                          
====================================================================================================
Total Epochs: 20 | Batch Size: 8 | Device: cuda
====================================================================================================

────────────────────────────────────────────────────────────────────────────────────────────────────
Epoch [ 1/20]
────────────────────────────────────────────────────────────────────────────────────────────────────

Epoch 1/20: 100%|██████████| 269/269 [00:39<00:00,  6.73it/s]
Evaluating: 100%|██████████| 168/168 [00:25<00:00,  6.71it/s]

* New best F1: 42.05%
TRAIN           | Loss:   1.3382 | Accuracy:  44.33% | F1-Score:  44.43%
VALIDATION      | Loss:   1.2591 | Accuracy:  43.55% | F1-Score:  42.05%

────────────────────────────────────────────────────────────────────────────────────────────────────
Epoch [ 2/20]
────────────────────────────────────────────────────────────────────────────────────────────────────

Epoch 2/20: 100%|██████████| 269/269 [00:39<00:00,  6.73it/s]
Evaluating: 100%|██████████| 168/168 [00:25<00:00,  6.65it/s]

* New best F1: 50.70%
TRAIN           | Loss:   1.1333 | Accuracy:  50.98% | F1-Score:  51.05%
VALIDATION      | Loss:   1.2063 | Accuracy:  50.71% | F1-Score:  50.70%

────────────────────────────────────────────────────────────────────────────────────────────────────
Epoch [ 3/20]
────────────────────────────────────────────────────────────────────────────────────────────────────

Epoch 3/20: 100%|██████████| 269/269 [00:39<00:00,  6.75it/s]
Evaluating: 100%|██████████| 168/168 [00:25<00:00,  6.70it/s]

TRAIN           | Loss:   1.0189 | Accuracy:  57.11% | F1-Score:  57.18%
VALIDATION      | Loss:   1.0997 | Accuracy:  54.14% | F1-Score:  49.25%

────────────────────────────────────────────────────────────────────────────────────────────────────
Epoch [ 4/20]
────────────────────────────────────────────────────────────────────────────────────────────────────

Epoch 4/20: 100%|██████████| 269/269 [00:40<00:00,  6.72it/s]
Evaluating: 100%|██████████| 168/168 [00:25<00:00,  6.66it/s]

* New best F1: 52.15%
TRAIN           | Loss:   0.9352 | Accuracy:  63.57% | F1-Score:  63.63%
VALIDATION      | Loss:   1.0866 | Accuracy:  54.59% | F1-Score:  52.15%

────────────────────────────────────────────────────────────────────────────────────────────────────
Epoch [ 5/20]
────────────────────────────────────────────────────────────────────────────────────────────────────

Epoch 5/20: 100%|██████████| 269/269 [00:39<00:00,  6.74it/s]
Evaluating: 100%|██████████| 168/168 [00:25<00:00,  6.69it/s]

* New best F1: 54.04%
TRAIN           | Loss:   0.9090 | Accuracy:  62.78% | F1-Score:  62.87%
VALIDATION      | Loss:   1.0523 | Accuracy:  56.52% | F1-Score:  54.04%

────────────────────────────────────────────────────────────────────────────────────────────────────
Epoch [ 6/20]
────────────────────────────────────────────────────────────────────────────────────────────────────

Epoch 6/20: 100%|██████████| 269/269 [00:39<00:00,  6.75it/s]
Evaluating: 100%|██████████| 168/168 [00:25<00:00,  6.68it/s]

* New best F1: 57.82%
TRAIN           | Loss:   0.8346 | Accuracy:  66.82% | F1-Score:  66.92%
VALIDATION      | Loss:   1.0594 | Accuracy:  58.31% | F1-Score:  57.82%

────────────────────────────────────────────────────────────────────────────────────────────────────
Epoch [ 7/20]
────────────────────────────────────────────────────────────────────────────────────────────────────

Epoch 7/20: 100%|██████████| 269/269 [00:39<00:00,  6.73it/s]
Evaluating: 100%|██████████| 168/168 [00:25<00:00,  6.70it/s]

* New best F1: 60.55%
TRAIN           | Loss:   0.7837 | Accuracy:  68.17% | F1-Score:  68.20%
VALIDATION      | Loss:   0.9782 | Accuracy:  60.85% | F1-Score:  60.55%

────────────────────────────────────────────────────────────────────────────────────────────────────
Epoch [ 8/20]
────────────────────────────────────────────────────────────────────────────────────────────────────

Epoch 8/20: 100%|██████████| 269/269 [00:39<00:00,  6.77it/s]
Evaluating: 100%|██████████| 168/168 [00:25<00:00,  6.65it/s]

* New best F1: 62.52%
TRAIN           | Loss:   0.7531 | Accuracy:  70.40% | F1-Score:  70.46%
VALIDATION      | Loss:   0.9748 | Accuracy:  62.94% | F1-Score:  62.52%

────────────────────────────────────────────────────────────────────────────────────────────────────
Epoch [ 9/20]
────────────────────────────────────────────────────────────────────────────────────────────────────

Epoch 9/20: 100%|██████████| 269/269 [00:39<00:00,  6.75it/s]
Evaluating: 100%|██████████| 168/168 [00:25<00:00,  6.69it/s]

TRAIN           | Loss:   0.7201 | Accuracy:  72.82% | F1-Score:  72.80%
VALIDATION      | Loss:   1.0036 | Accuracy:  60.40% | F1-Score:  59.04%

────────────────────────────────────────────────────────────────────────────────────────────────────
Epoch [10/20]
────────────────────────────────────────────────────────────────────────────────────────────────────

Epoch 10/20: 100%|██████████| 269/269 [00:39<00:00,  6.73it/s]
Evaluating: 100%|██████████| 168/168 [00:25<00:00,  6.68it/s]

* New best F1: 62.83%
TRAIN           | Loss:   0.6842 | Accuracy:  74.26% | F1-Score:  74.28%
VALIDATION      | Loss:   1.0017 | Accuracy:  62.71% | F1-Score:  62.83%

────────────────────────────────────────────────────────────────────────────────────────────────────
Epoch [11/20]
────────────────────────────────────────────────────────────────────────────────────────────────────

Epoch 11/20: 100%|██████████| 269/269 [00:39<00:00,  6.75it/s]
Evaluating: 100%|██████████| 168/168 [00:25<00:00,  6.69it/s]

TRAIN           | Loss:   0.6515 | Accuracy:  74.44% | F1-Score:  74.41%
VALIDATION      | Loss:   1.0346 | Accuracy:  62.79% | F1-Score:  62.46%

────────────────────────────────────────────────────────────────────────────────────────────────────
Epoch [12/20]
────────────────────────────────────────────────────────────────────────────────────────────────────

Epoch 12/20: 100%|██████████| 269/269 [00:39<00:00,  6.74it/s]
Evaluating: 100%|██████████| 168/168 [00:25<00:00,  6.69it/s]

* New best F1: 63.58%
TRAIN           | Loss:   0.5958 | Accuracy:  77.04% | F1-Score:  77.04%
VALIDATION      | Loss:   0.9960 | Accuracy:  63.61% | F1-Score:  63.58%

────────────────────────────────────────────────────────────────────────────────────────────────────
Epoch [13/20]
────────────────────────────────────────────────────────────────────────────────────────────────────

Epoch 13/20: 100%|██████████| 269/269 [00:39<00:00,  6.74it/s]
Evaluating: 100%|██████████| 168/168 [00:25<00:00,  6.69it/s]

* New best F1: 64.92%
TRAIN           | Loss:   0.5404 | Accuracy:  79.97% | F1-Score:  80.00%
VALIDATION      | Loss:   0.9321 | Accuracy:  65.03% | F1-Score:  64.92%

────────────────────────────────────────────────────────────────────────────────────────────────────
Epoch [14/20]
────────────────────────────────────────────────────────────────────────────────────────────────────

Epoch 14/20: 100%|██████████| 269/269 [00:39<00:00,  6.76it/s]
Evaluating: 100%|██████████| 168/168 [00:25<00:00,  6.67it/s]

* New best F1: 65.59%
TRAIN           | Loss:   0.4832 | Accuracy:  81.60% | F1-Score:  81.58%
VALIDATION      | Loss:   0.9629 | Accuracy:  66.37% | F1-Score:  65.59%

────────────────────────────────────────────────────────────────────────────────────────────────────
Epoch [15/20]
────────────────────────────────────────────────────────────────────────────────────────────────────

Epoch 15/20: 100%|██████████| 269/269 [00:39<00:00,  6.75it/s]
Evaluating: 100%|██████████| 168/168 [00:25<00:00,  6.69it/s]

* New best F1: 66.02%
TRAIN           | Loss:   0.4924 | Accuracy:  81.51% | F1-Score:  81.51%
VALIDATION      | Loss:   1.1089 | Accuracy:  65.55% | F1-Score:  66.02%

────────────────────────────────────────────────────────────────────────────────────────────────────
Epoch [16/20]
────────────────────────────────────────────────────────────────────────────────────────────────────

Epoch 16/20: 100%|██████████| 269/269 [00:39<00:00,  6.74it/s]
Evaluating: 100%|██████████| 168/168 [00:25<00:00,  6.70it/s]

TRAIN           | Loss:   0.4639 | Accuracy:  83.04% | F1-Score:  83.06%
VALIDATION      | Loss:   1.0278 | Accuracy:  63.68% | F1-Score:  63.57%

────────────────────────────────────────────────────────────────────────────────────────────────────
Epoch [17/20]
────────────────────────────────────────────────────────────────────────────────────────────────────

Epoch 17/20: 100%|██████████| 269/269 [00:39<00:00,  6.75it/s]
Evaluating: 100%|██████████| 168/168 [00:25<00:00,  6.67it/s]

TRAIN           | Loss:   0.4205 | Accuracy:  84.34% | F1-Score:  84.34%
VALIDATION      | Loss:   1.0212 | Accuracy:  65.03% | F1-Score:  64.79%

────────────────────────────────────────────────────────────────────────────────────────────────────
Epoch [18/20]
────────────────────────────────────────────────────────────────────────────────────────────────────

Epoch 18/20: 100%|██████████| 269/269 [00:39<00:00,  6.74it/s]
Evaluating: 100%|██████████| 168/168 [00:25<00:00,  6.68it/s]

TRAIN           | Loss:   0.3885 | Accuracy:  86.34% | F1-Score:  86.30%
VALIDATION      | Loss:   0.9757 | Accuracy:  65.47% | F1-Score:  65.30%

────────────────────────────────────────────────────────────────────────────────────────────────────
Epoch [19/20]
────────────────────────────────────────────────────────────────────────────────────────────────────

Epoch 19/20: 100%|██████████| 269/269 [00:39<00:00,  6.74it/s]
Evaluating: 100%|██████████| 168/168 [00:25<00:00,  6.71it/s]

TRAIN           | Loss:   0.3904 | Accuracy:  85.22% | F1-Score:  85.22%
VALIDATION      | Loss:   1.0611 | Accuracy:  64.43% | F1-Score:  64.43%

────────────────────────────────────────────────────────────────────────────────────────────────────
Epoch [20/20]
────────────────────────────────────────────────────────────────────────────────────────────────────

Epoch 20/20: 100%|██████████| 269/269 [00:39<00:00,  6.75it/s]
Evaluating: 100%|██████████| 168/168 [00:25<00:00,  6.67it/s]

TRAIN           | Loss:   0.3613 | Accuracy:  86.66% | F1-Score:  86.66%
VALIDATION      | Loss:   1.0374 | Accuracy:  65.40% | F1-Score:  65.65%

====================================================================================================
                                         TRAINING COMPLETED                                         
====================================================================================================


Best validation F1: 66.02%



Testing the model...

Evaluating: 100%|██████████| 168/168 [00:25<00:00,  6.65it/s]


====================================================================================================
                                            TEST RESULTS                                            
====================================================================================================
Loss:   0.8228 | Accuracy:  70.83% | F1-Score:  70.81%
====================================================================================================